{
  "slug": "gen-trivia",
  "name": "Gen Trivia",
  "description": "AI-powered Jeopardy-style trivia game",
  "url": "https://loudog.uno/gen-trivia",
  "repo": "https://github.com/loudoguno/gen-trivia",
  "status": "beta",
  "categories": ["game", "trivia", "ai"],
  "firstReleased": "2025-12-01",
  "lastUpdated": "2025-12-01T00:00:00Z",
  "features": {
    "changelog": true,
    "roadmap": false,
    "issueVoting": false,
    "publicDocs": false
  }
}
